{
  "$schema": "https://json-schema.org/draft/2020-12/schema",
  "$id": "https://coregentis.org/schemas/v1.0/Confirm.schema.json",
  "version": "1.0.0",
  "title": "MPLP.Confirm Schema",
  "description": "Schema for freezing and confirming task plans in multi-agent workflows.",
  "type": "object",
  "properties": {
    "confirmId": {
      "type": "string",
      "description": "Unique identifier for the confirmation instance."
    },
    "planId": {
      "type": "string",
      "description": "Associated plan identifier being confirmed."
    },
    "confirmedBy": {
      "type": "string",
      "description": "User or agent that performed the confirmation."
    },
    "confirmedAt": {
      "type": "string",
      "format": "date-time",
      "description": "Timestamp of the confirmation."
    },
    "approvalStages": {
      "type": "array",
      "description": "Multi-stage approval flow for the confirmation process.",
      "items": {
        "type": "object",
        "properties": {
          "stageId": {
            "type": "string",
            "description": "Identifier of the approval stage."
          },
          "approver": {
            "type": "string",
            "description": "User or agent responsible for approving this stage."
          },
          "status": {
            "type": "string",
            "enum": ["pending", "approved", "rejected"],
            "description": "Status of this stage."
          },
          "comment": {
            "type": "string",
            "description": "Optional comment or feedback from the approver."
          },
          "timestamp": {
            "type": "string",
            "format": "date-time",
            "description": "Timestamp of approval or rejection."
          }
        },
        "required": ["stageId", "approver", "status"]
      }
    }
  },
  "required": ["confirmId", "planId", "confirmedBy", "confirmedAt", "approvalStages"],
  "additionalProperties": true
}